{"$schema":"https://json-schema.org/draft/2020-12/schema","$id":"https://schemas.socioprophet.org/sociosphere/orggov-topology.v0.1.schema.json","title":"OrgGov Estate Topology v0.1","type":"object","additionalProperties":false,"required":["schemaVersion","recordType","recordId","parentIssueRef","productLoop","canonicalRepos","ownership","dependencies","changePropagation","releaseReadiness","evidenceRefs","provenance"],"properties":{"schemaVersion":{"const":"orggov.topology.v0.1"},"recordType":{"const":"OrgGovEstateTopology"},"recordId":{"type":"string"},"parentIssueRef":{"type":"string"},"productLoop":{"type":"array","minItems":1,"items":{"type":"string"}},"canonicalRepos":{"type":"array","minItems":1,"items":{"type":"string"}},"ownership":{"type":"array","minItems":1,"items":{"type":"object","additionalProperties":false,"required":["objectClass","ownerRepo","downstreamRepos"],"properties":{"objectClass":{"type":"string"},"ownerRepo":{"type":"string"},"downstreamRepos":{"type":"array","items":{"type":"string"}}}}},"dependencies":{"type":"array","items":{"type":"object","additionalProperties":false,"required":["fromRepo","relation","toRepo"],"properties":{"fromRepo":{"type":"string"},"relation":{"type":"string"},"toRepo":{"type":"string"}}}},"changePropagation":{"type":"array","items":{"type":"object","additionalProperties":false,"required":["trigger","sourceRepo","requiredDownstreamUpdates"],"properties":{"trigger":{"type":"string"},"sourceRepo":{"type":"string"},"requiredDownstreamUpdates":{"type":"array","items":{"type":"string"}}}}},"releaseReadiness":{"type":"object","additionalProperties":false,"required":["minimumMergedSlices","currentMergedSlices","remainingFirstPassLanes"],"properties":{"minimumMergedSlices":{"type":"integer"},"currentMergedSlices":{"type":"integer"},"remainingFirstPassLanes":{"type":"array","items":{"type":"string"}}}},"evidenceRefs":{"type":"array","minItems":1,"items":{"type":"string"}},"provenance":{"type":"object","additionalProperties":false,"required":["createdBy","createdAt","nonSecret"],"properties":{"createdBy":{"type":"string"},"createdAt":{"type":"string"},"nonSecret":{"type":"boolean"}}},"labels":{"type":"object","additionalProperties":{"type":"string"}}}}
