{"schemaVersion":"orggov.topology.v0.1","recordType":"OrgGovEstateTopology","recordId":"orggov-topology:v0.1","parentIssueRef":"github://SocioProphet/prophet-platform/issues/406","productLoop":["Objective","Workroom","Actor","Role","Policy","Asset","Action","Evidence","Review","Outcome","Score","Learning"],"canonicalRepos":["SocioProphet/prophet-platform","SocioProphet/ontogenesis","SocioProphet/prophet-workspace","SocioProphet/agent-registry","SocioProphet/policy-fabric","SocioProphet/agentplane","SocioProphet/model-governance-ledger","SocioProphet/delivery-excellence","SocioProphet/sherlock-search","SocioProphet/sociosphere","SourceOS-Linux/sourceos-syncd"],"ownership":[{"objectClass":"control-plane-contract","ownerRepo":"SocioProphet/prophet-platform","downstreamRepos":["SocioProphet/ontogenesis","SocioProphet/prophet-workspace","SocioProphet/agent-registry","SocioProphet/policy-fabric","SocioProphet/agentplane","SocioProphet/model-governance-ledger","SocioProphet/delivery-excellence","SocioProphet/sherlock-search","SocioProphet/sociosphere","SourceOS-Linux/sourceos-syncd"]},{"objectClass":"ontology-term","ownerRepo":"SocioProphet/ontogenesis","downstreamRepos":["SocioProphet/prophet-platform","SocioProphet/prophet-workspace","SocioProphet/agent-registry","SocioProphet/policy-fabric","SocioProphet/agentplane","SocioProphet/sherlock-search"]},{"objectClass":"workroom-control-room","ownerRepo":"SocioProphet/prophet-workspace","downstreamRepos":["SocioProphet/sherlock-search","SocioProphet/delivery-excellence"]},{"objectClass":"actor-authority-binding","ownerRepo":"SocioProphet/agent-registry","downstreamRepos":["SocioProphet/policy-fabric","SocioProphet/agentplane","SocioProphet/prophet-workspace"]},{"objectClass":"policy-decision","ownerRepo":"SocioProphet/policy-fabric","downstreamRepos":["SocioProphet/agentplane","SocioProphet/sherlock-search","SocioProphet/delivery-excellence"]},{"objectClass":"execution-evidence","ownerRepo":"SocioProphet/agentplane","downstreamRepos":["SocioProphet/model-governance-ledger","SocioProphet/sherlock-search","SocioProphet/delivery-excellence"]},{"objectClass":"model-tool-receipt","ownerRepo":"SocioProphet/model-governance-ledger","downstreamRepos":["SocioProphet/sherlock-search","SocioProphet/delivery-excellence"]},{"objectClass":"scorecard","ownerRepo":"SocioProphet/delivery-excellence","downstreamRepos":["SocioProphet/prophet-workspace","SocioProphet/sherlock-search"]},{"objectClass":"search-packet","ownerRepo":"SocioProphet/sherlock-search","downstreamRepos":["SocioProphet/prophet-workspace"]},{"objectClass":"state-integrity-binding","ownerRepo":"SourceOS-Linux/sourceos-syncd","downstreamRepos":["SocioProphet/agentplane","SocioProphet/sherlock-search","SocioProphet/delivery-excellence"]}],"dependencies":[{"fromRepo":"SocioProphet/prophet-workspace","relation":"renders","toRepo":"SocioProphet/prophet-platform"},{"fromRepo":"SocioProphet/policy-fabric","relation":"authorizes","toRepo":"SocioProphet/agent-registry"},{"fromRepo":"SocioProphet/agentplane","relation":"emits-evidence-for","toRepo":"SocioProphet/policy-fabric"},{"fromRepo":"SocioProphet/model-governance-ledger","relation":"records-model-tool-context-for","toRepo":"SocioProphet/agentplane"},{"fromRepo":"SocioProphet/delivery-excellence","relation":"scores","toRepo":"SocioProphet/agentplane"},{"fromRepo":"SocioProphet/sherlock-search","relation":"indexes","toRepo":"SocioProphet/agentplane"},{"fromRepo":"SourceOS-Linux/sourceos-syncd","relation":"provides-local-state-evidence-to","toRepo":"SocioProphet/agentplane"}],"changePropagation":[{"trigger":"platform contract changes","sourceRepo":"SocioProphet/prophet-platform","requiredDownstreamUpdates":["refresh ontology alignment","refresh workspace fixture","refresh registry and policy refs","refresh evidence/search/scorecard fixtures"]},{"trigger":"ontology term changes","sourceRepo":"SocioProphet/ontogenesis","requiredDownstreamUpdates":["refresh platform schema names","refresh workspace panel mappings","refresh search graph edges"]},{"trigger":"policy decision vocabulary changes","sourceRepo":"SocioProphet/policy-fabric","requiredDownstreamUpdates":["refresh AgentPlane policy refs","refresh Sherlock ranking hints","refresh Delivery Excellence policy coverage dimensions"]},{"trigger":"evidence binding changes","sourceRepo":"SocioProphet/agentplane","requiredDownstreamUpdates":["refresh model receipt refs","refresh Sherlock packet docs","refresh scorecard evidence dimensions"]}],"releaseReadiness":{"minimumMergedSlices":11,"currentMergedSlices":10,"remainingFirstPassLanes":["SourceOS-Linux/sourceos-syncd"]},"evidenceRefs":["github://SocioProphet/prophet-platform/issues/406","github://SocioProphet/prophet-platform/pull/409","github://SocioProphet/ontogenesis/pull/43","github://SocioProphet/prophet-workspace/pull/16","github://SocioProphet/agent-registry/pull/23","github://SocioProphet/policy-fabric/pull/61","github://SocioProphet/agentplane/pull/128","github://SocioProphet/model-governance-ledger/pull/15","github://SocioProphet/delivery-excellence/pull/23","github://SocioProphet/sherlock-search/pull/44"],"provenance":{"createdBy":"sociosphere://orggov-topology-fixture","createdAt":"2026-05-07T05:00:00Z","nonSecret":true},"labels":{"program":"orggov-v0","parent":"SocioProphet/prophet-platform#406","sociosphereIssue":"SocioProphet/sociosphere#272"}}
